Gurobi 12.0.3 (linux64) logging started Wed Dec 10 14:28:59 2025

Set parameter LogFile to value "/home/bazzo/Scrivania/fjsp_rescheduling/simulations/logs/EX4/gurobi_exp4.log"
Set parameter OutputFlag to value 1
Gurobi Optimizer version 12.0.3 build v12.0.3rc0 (linux64 - "Ubuntu 22.04.5 LTS")

CPU model: Intel(R) Xeon(R) W-2145 CPU @ 3.70GHz, instruction set [SSE2|AVX|AVX2|AVX512]
Thread count: 8 physical cores, 16 logical processors, using up to 16 threads

Optimize a model with 4591 rows, 3145 columns and 18855 nonzeros
Model fingerprint: 0xde516d46
Model has 12 quadratic constraints
Coefficient statistics:
  Matrix range     [1e+00, 7e+03]
  QMatrix range    [1e+00, 1e+00]
  QLMatrix range   [1e+00, 1e+00]
  Objective range  [0e+00, 0e+00]
  Bounds range     [1e+00, 1e+00]
  RHS range        [1e+00, 2e+04]
Presolve removed 3312 rows and 2552 columns
Presolve time: 0.00s
Presolved: 1301 rows, 696 columns, 6117 nonzeros
Presolved model has 11 second-order cone constraints
Ordering time: 0.00s

Barrier statistics:
 Dense cols : 56
 AA' NZ     : 9.005e+03
 Factor NZ  : 1.413e+04 (roughly 1 MB of memory)
 Factor Ops : 3.163e+05 (less than 1 second per iteration)
 Threads    : 1

                  Objective                Residual
Iter       Primal          Dual         Primal    Dual     Compl     Time
   0   0.00000000e+00 -9.64075652e+03  2.75e+03 1.00e-01  8.51e+01     0s
   1   0.00000000e+00 -2.20432161e+04  1.13e+03 5.40e+00  3.26e+01     0s
   2   0.00000000e+00 -1.29201656e+04  2.45e+02 1.04e+00  8.80e+00     0s
   3   0.00000000e+00 -6.72318609e+03  7.90e+01 2.51e-01  3.37e+00     0s
   4   0.00000000e+00 -2.22691393e+03  2.47e+01 3.77e-02  9.82e-01     0s
   5   0.00000000e+00 -8.22141145e+02  9.56e+00 1.35e-02  3.49e-01     0s
   6   0.00000000e+00 -2.24585750e+02  5.12e-01 4.51e-03  9.16e-02     0s
   7   0.00000000e+00 -8.99723960e+00  3.69e-03 6.52e-04  3.68e-03     0s
   8   0.00000000e+00 -1.65286013e+00  2.31e-04 3.10e-03  6.72e-04     0s
   9   0.00000000e+00 -1.60156158e+00  2.07e-04 3.08e-03  6.40e-04     0s
  10   0.00000000e+00 -1.73978921e+00  1.57e-04 3.56e-03  5.74e-04     0s
  11   0.00000000e+00 -1.62797895e+00  1.23e-04 3.28e-03  5.28e-04     0s
  12   0.00000000e+00 -7.03706944e-01  2.55e-06 4.69e-03  3.49e-04     0s
  13   0.00000000e+00 -5.64049044e-01  7.48e-08 3.76e-03  2.80e-04     0s
  14   0.00000000e+00 -6.24885676e-04  1.86e-07 4.17e-06  3.10e-07     0s
  15   0.00000000e+00 -6.46829014e-07  6.47e-08 4.75e-09  3.53e-10     0s

Barrier solved model in 15 iterations and 0.03 seconds (0.03 work units)
Optimal objective 0.00000000e+00

Set parameter TimeLimit to value 2160
Set parameter Presolve to value 2
Set parameter MIPFocus to value 3
Set parameter Heuristics to value 0.1
Set parameter ImproveStartGap to value 0.5
Set parameter Presolve to value 2
Gurobi Optimizer version 12.0.3 build v12.0.3rc0 (linux64 - "Ubuntu 22.04.5 LTS")

CPU model: Intel(R) Xeon(R) W-2145 CPU @ 3.70GHz, instruction set [SSE2|AVX|AVX2|AVX512]
Thread count: 8 physical cores, 16 logical processors, using up to 16 threads

Non-default parameters:
TimeLimit  2160
Heuristics  0.1
MIPFocus  3
Presolve  2
ImproveStartGap  0.5

Optimize a model with 4591 rows, 3145 columns and 18855 nonzeros
Model fingerprint: 0xd09fdd44
Model has 12 quadratic constraints
Variable types: 12 continuous, 3133 integer (3024 binary)
Coefficient statistics:
  Matrix range     [1e+00, 7e+03]
  QMatrix range    [1e+00, 1e+00]
  QLMatrix range   [1e+00, 1e+00]
  Objective range  [1e+00, 1e+00]
  Bounds range     [1e+00, 1e+00]
  RHS range        [1e+00, 2e+04]
Presolve removed 3282 rows and 2553 columns
Presolve time: 0.04s
Presolved: 1309 rows, 592 columns, 6612 nonzeros
Presolved model has 11 quadratic constraint(s)
Variable types: 11 continuous, 581 integer (542 binary)
Root relaxation presolve removed 912 rows and 456 columns
Root relaxation presolved: 397 rows, 136 columns, 2145 nonzeros


Root relaxation: objective 1.000000e+02, 14 iterations, 0.01 seconds (0.01 work units)

    Nodes    |    Current Node    |     Objective Bounds      |     Work
 Expl Unexpl |  Obj  Depth IntInf | Incumbent    BestBd   Gap | It/Node Time

H    0     0                    2.950615e+08  100.00000   100%     -    0s
*    0     0               0    2.950615e+08  100.00000   100%     -    0s
     0     0  100.00000    0   17 2.9506e+08  100.00000   100%     -    0s
H    0     0                    6.771377e+07  100.00000   100%     -    0s
H    0     0                    4768071.0000  100.00000   100%     -    0s
H    0     0                    4765246.0000  100.00000   100%     -    0s
H    0     0                    1427737.0000  100.00000   100%     -    0s
H    0     0                    1402325.0000  100.00000   100%     -    0s
H    0     0                    1393489.0000  100.00000   100%     -    0s
H    0     0                    1363521.0000  100.00000   100%     -    0s
     0     0  181.00000    0    8 1363521.00  181.00000   100%     -    0s
H    0     0                    1251202.0100  181.00000   100%     -    0s
H    0     0                    1250484.0000  181.00000   100%     -    0s
H    0     0                    720600.00000  181.00000   100%     -    0s
H    0     0                    530880.00000  181.00000   100%     -    0s
H    0     0                    519151.00000  181.00000   100%     -    0s
H    0     0                    519096.00000  181.00000   100%     -    0s
     0     0 1106.00000    0   12 519096.000 1106.00000   100%     -    0s
H    0     0                    501699.00000 1106.00000   100%     -    0s
H    0     0                    494406.00000 1106.00000   100%     -    0s
H    0     0                    488579.00000 4408.00000  99.1%     -    0s
H    0     0                    469574.00000 4408.00000  99.1%     -    0s
H    0     0                    458223.00000 4408.00000  99.0%     -    0s
H    0     0                    450056.00000 4408.00000  99.0%     -    0s
H    0     0                    449859.00000 4408.00000  99.0%     -    0s
H    0     0                    449091.00000 4408.00000  99.0%     -    0s
     0     0 5131.00000    0   24 449091.000 5131.00000  98.9%     -    0s
H    0     0                    405795.00000 5131.00000  98.7%     -    0s
     0     0 6257.00000    0   43 405795.000 6257.00000  98.5%     -    0s
H    0     0                    405046.00000 6257.00000  98.5%     -    0s
H    0     0                    404757.00000 10113.0000  97.5%     -    1s
H    0     0                    352497.00000 10113.0000  97.1%     -    1s
H    0     0                    352210.00000 10113.0000  97.1%     -    1s
     0     0 10133.0000    0   44 352210.000 10133.0000  97.1%     -    1s
H    0     0                    335697.00000 10133.0000  97.0%     -    1s
     0     0 10133.0000    0   53 335697.000 10133.0000  97.0%     -    1s
     0     0 17244.3020    0   64 335697.000 17244.3020  94.9%     -    1s
     0     0 18288.1903    0   62 335697.000 18288.1903  94.6%     -    1s
H    0     0                    274974.00000 18288.1903  93.3%     -    1s
     0     0 20331.4681    0   66 274974.000 20331.4681  92.6%     -    2s
     0     0 21068.5939    0   62 274974.000 21068.5939  92.3%     -    2s
     0     0 25762.3195    0   59 274974.000 25762.3195  90.6%     -    2s
     0     0 28915.4244    0   58 274974.000 28915.4244  89.5%     -    2s
H    0     0                    274787.00000 28915.4244  89.5%     -    2s
H    0     0                    269387.00000 28915.4244  89.3%     -    2s
     0     0 31775.8418    0   53 269387.000 31775.8418  88.2%     -    3s
     0     0 35682.2006    0   63 269387.000 35682.2006  86.8%     -    3s
     0     0 38543.4492    0   59 269387.000 38543.4492  85.7%     -    3s
     0     0 40639.3031    0   56 269387.000 40639.3031  84.9%     -    3s
     0     0 43625.9929    0   70 269387.000 43625.9929  83.8%     -    4s
     0     0 46960.8939    0   64 269387.000 46960.8939  82.6%     -    4s
     0     0 47772.9651    0   60 269387.000 47772.9651  82.3%     -    4s
     0     0 48851.9265    0   51 269387.000 48851.9265  81.9%     -    4s
     0     0 49461.5453    0   63 269387.000 49461.5453  81.6%     -    4s
     0     0 50738.3446    0   61 269387.000 50738.3446  81.2%     -    4s
     0     0 51635.1943    0   59 269387.000 51635.1943  80.8%     -    5s
     0     0 52611.5412    0   64 269387.000 52611.5412  80.5%     -    5s
     0     0 53190.0000    0   62 269387.000 53190.0000  80.3%     -    5s
     0     0 53645.1587    0   70 269387.000 53645.1587  80.1%     -    5s
     0     0 53645.1587    0   64 269387.000 53645.1587  80.1%     -    5s
     0     0 53735.9170    0   69 269387.000 53735.9170  80.1%     -    5s
     0     0 53849.4183    0   71 269387.000 53849.4183  80.0%     -    5s
     0     0 54048.1092    0   74 269387.000 54048.1092  79.9%     -    5s
     0     0 54648.7357    0   72 269387.000 54648.7357  79.7%     -    5s
     0     0 54662.7526    0   75 269387.000 54662.7526  79.7%     -    5s
     0     0 54759.9883    0   71 269387.000 54759.9883  79.7%     -    5s
     0     0 54822.9433    0   59 269387.000 54822.9433  79.6%     -    5s
     0     2 54822.9433    0   56 269387.000 54822.9433  79.6%     -    5s
   452   442 59119.1122   13   86 269387.000 55938.6768  79.2%  69.4   10s
  1243  1031 93001.7825   23   54 269387.000 62378.3119  76.8%   110   15s
  4708  4204 103988.142   28   80 269387.000 86313.5829  68.0%  70.5   20s
  9318  8591 107115.318   30   41 269387.000 102988.870  61.8%  55.7   25s
 15174 14020 114276.437   33   60 269387.000 109884.968  59.2%  47.7   30s
H16842 14803                    267143.00000 112053.766  58.1%  46.4   30s
 21407 19851 139928.874   39   35 267143.000 117452.823  56.0%  43.1   35s
H22955 20804                    265523.00000 118388.804  55.4%  42.1   35s
H23019 19730                    229839.00000 118414.325  48.5%  42.0   35s
H23141 18016                    199064.00000 118445.696  40.5%  42.0   35s

Resetting heuristic parameters to focus on improving solution
(using Heuristics=0.5 and RINS=10)...

 23990 18199 138122.150   32   34 199064.000 119244.074  40.1%  41.6   37s
 25034 18895 170418.677   39   43 199064.000 121131.138  39.1%  41.6   40s
 26871 19992     cutoff   26      199064.000 123113.651  38.2%  40.9   45s
 29329 21409 128281.079   39   25 199064.000 125851.634  36.8%  40.3   50s
 31239 22482 133752.782   33   35 199064.000 127991.030  35.7%  39.9   55s
 33748 23884 infeasible   29      199064.000 131057.575  34.2%  39.4   60s
 35700 24902     cutoff   36      199064.000 133586.447  32.9%  39.3   65s
 38417 26025     cutoff   35      199064.000 136999.362  31.2%  39.0   71s
 40449 26876 164763.905   38   44 199064.000 138624.425  30.4%  38.7   75s
 42439 27637     cutoff   39      199064.000 140417.816  29.5%  38.6   80s
 44470 28347 189693.000   41   29 199064.000 141704.302  28.8%  38.4   85s
 47321 29115 146989.287   45   38 199064.000 143642.757  27.8%  38.1   91s
 49539 29669 147283.651   38   46 199064.000 144900.532  27.2%  37.9   95s
 51711 30184 150162.391   30   58 199064.000 146300.000  26.5%  37.8  100s
 53913 30582 152008.206   40   39 199064.000 147685.549  25.8%  37.7  105s
 56836 31099     cutoff   36      199064.000 149568.935  24.9%  37.5  111s
 59071 31491 160962.180   29   43 199064.000 150918.059  24.2%  37.4  116s
 61376 31874 infeasible   36      199064.000 152253.487  23.5%  37.3  120s
 63746 32128     cutoff   36      199064.000 153564.823  22.9%  37.0  125s
 66098 32339 192633.448   37   37 199064.000 155056.669  22.1%  36.9  130s
 68564 32431     cutoff   30      199064.000 156686.800  21.3%  36.8  135s
 71948 32750 177295.693   36   39 199064.000 158289.000  20.5%  36.4  141s
 74580 32784 infeasible   39      199064.000 159664.000  19.8%  36.1  146s
 77048 32910 162644.000   44    4 199064.000 160932.350  19.2%  36.0  151s
 79642 33027 166055.514   44   22 199064.000 161929.730  18.7%  35.7  155s
 82344 33069 infeasible   41      199064.000 163064.785  18.1%  35.3  160s
 85057 32951 infeasible   52      199064.000 164291.524  17.5%  35.1  165s
 87822 32789     cutoff   30      199064.000 165588.339  16.8%  34.9  170s
 90681 32561 167902.627   49   21 199064.000 166988.089  16.1%  34.6  175s
 93602 32358     cutoff   42      199064.000 168011.040  15.6%  34.3  180s
 96552 32035     cutoff   36      199064.000 169220.703  15.0%  34.0  185s
 99565 31460 infeasible   41      199064.000 170508.000  14.3%  33.8  190s
 102512 30964     cutoff   38      199064.000 171689.099  13.8%  33.5  195s
 105522 30549 173305.830   42   32 199064.000 172943.125  13.1%  33.2  200s
 108489 29788 176188.222   31   29 199064.000 174222.075  12.5%  33.0  205s
 112396 28781     cutoff   36      199064.000 175792.839  11.7%  32.7  211s
 115480 27889 186776.852   56   17 199064.000 176929.126  11.1%  32.4  215s
 118622 26926     cutoff   33      199064.000 178158.539  10.5%  32.1  220s
 122749 25640     cutoff   37      199064.000 179837.981  9.66%  31.7  226s
 125880 24511 181342.000   46   19 199064.000 180974.000  9.09%  31.5  230s
 130003 23081 188757.000   37   31 199064.000 182519.759  8.31%  31.1  236s
 133233 21775     cutoff   40      199064.000 183867.669  7.63%  30.8  240s
 137373 19971     cutoff   40      199064.000 185484.000  6.82%  30.5  246s
 140603 18435     cutoff   38      199064.000 186737.495  6.19%  30.2  250s
 144683 16389 infeasible   37      199064.000 188213.926  5.45%  29.9  255s
 149136 13975 infeasible   31      199064.000 189871.803  4.62%  29.4  260s
 153457 11425 infeasible   34      199064.000 191499.579  3.80%  29.0  265s
 159064  7719     cutoff   31      199064.000 193966.297  2.56%  28.5  270s
 164676  3349 infeasible   52      199064.000 196535.470  1.27%  28.0  275s

Cutting planes:
  Learned: 290
  Gomory: 189
  Lift-and-project: 224
  Cover: 32
  Implied bound: 3
  MIR: 1664
  Mixing: 172
  StrongCG: 451
  Flow cover: 4019
  Inf proof: 2
  Zero half: 546
  RLT: 114
  Relax-and-lift: 148

Explored 169730 nodes (4656774 simplex iterations) in 278.02 seconds (291.79 work units)
Thread count was 16 (of 16 available processors)

Solution count 10: 199064 229839 265523 ... 274974

Optimal solution found (tolerance 1.00e-04)
Best objective 1.990640000000e+05, best bound 1.990464269754e+05, gap 0.0088%

User-callback calls 362621, time in user-callback 0.55 sec
Set parameter TimeLimit to value 1080
Gurobi Optimizer version 12.0.3 build v12.0.3rc0 (linux64 - "Ubuntu 22.04.5 LTS")

CPU model: Intel(R) Xeon(R) W-2145 CPU @ 3.70GHz, instruction set [SSE2|AVX|AVX2|AVX512]
Thread count: 8 physical cores, 16 logical processors, using up to 16 threads

Non-default parameters:
TimeLimit  1080
Heuristics  0.1
MIPFocus  3
Presolve  2
ImproveStartGap  0.5

Optimize a model with 4592 rows, 3145 columns and 18867 nonzeros
Model fingerprint: 0x4ab62c3a
Model has 12 quadratic constraints
Variable types: 12 continuous, 3133 integer (3024 binary)
Coefficient statistics:
  Matrix range     [1e+00, 7e+03]
  QMatrix range    [1e+00, 1e+00]
  QLMatrix range   [1e+00, 1e+00]
  Objective range  [5e-01, 5e-01]
  Bounds range     [1e+00, 1e+00]
  RHS range        [1e+00, 2e+05]

MIP start from previous solve produced solution with objective 56 (0.00s)
Loaded MIP start from previous solve with objective 56

Presolve removed 3349 rows and 2582 columns
Presolve time: 0.05s
Presolved: 1243 rows, 563 columns, 6053 nonzeros
Presolved model has 11 quadratic constraint(s)
Found heuristic solution: objective 16.0000000
Variable types: 11 continuous, 552 integer (513 binary)
Root relaxation presolve removed 506 rows and 257 columns
Root relaxation presolved: 737 rows, 306 columns, 3639 nonzeros


Root relaxation: objective 5.000000e+00, 35 iterations, 0.00 seconds (0.00 work units)

    Nodes    |    Current Node    |     Objective Bounds      |     Work
 Expl Unexpl |  Obj  Depth IntInf | Incumbent    BestBd   Gap | It/Node Time

     0     0    5.00000    0    -   16.00000    5.00000  68.8%     -    0s
     0     0    5.00000    0   31   16.00000    5.00000  68.8%     -    0s
H    0     0                      13.0000000    5.00000  61.5%     -    0s
     0     0    5.00000    0   23   13.00000    5.00000  61.5%     -    0s
     0     0    5.00000    0   18   13.00000    5.00000  61.5%     -    0s
     0     0    5.00000    0   30   13.00000    5.00000  61.5%     -    0s
     0     0    5.05151    0   29   13.00000    5.05151  61.1%     -    0s
     0     0    5.05458    0   15   13.00000    5.05458  61.1%     -    0s
     0     0    5.22879    0   15   13.00000    5.22879  59.8%     -    0s
     0     0    5.24163    0   32   13.00000    5.24163  59.7%     -    0s
     0     0    6.00000    0   13   13.00000    6.00000  53.8%     -    0s
     0     0    6.00000    0   59   13.00000    6.00000  53.8%     -    0s
     0     0    6.00000    0   45   13.00000    6.00000  53.8%     -    1s
     0     0    6.00000    0   40   13.00000    6.00000  53.8%     -    1s
     0     0    6.00000    0   35   13.00000    6.00000  53.8%     -    1s
     0     0    6.00000    0   53   13.00000    6.00000  53.8%     -    1s
     0     0    6.00000    0   48   13.00000    6.00000  53.8%     -    1s
     0     0    6.00000    0   22   13.00000    6.00000  53.8%     -    1s
     0     0    6.00000    0   24   13.00000    6.00000  53.8%     -    1s
     0     0    6.00000    0   45   13.00000    6.00000  53.8%     -    2s
     0     0    6.00000    0   30   13.00000    6.00000  53.8%     -    2s
     0     0    6.00000    0   50   13.00000    6.00000  53.8%     -    2s
     0     0    6.00000    0   35   13.00000    6.00000  53.8%     -    2s
     0     0    6.00000    0   47   13.00000    6.00000  53.8%     -    2s
     0     0    6.00000    0   19   13.00000    6.00000  53.8%     -    2s
     0     0    6.00000    0   51   13.00000    6.00000  53.8%     -    2s
     0     0    6.00000    0   23   13.00000    6.00000  53.8%     -    3s
     0     0    6.00000    0   36   13.00000    6.00000  53.8%     -    3s
     0     0    6.00000    0   26   13.00000    6.00000  53.8%     -    3s
     0     0    6.00000    0   28   13.00000    6.00000  53.8%     -    3s
     0     0    6.00000    0   32   13.00000    6.00000  53.8%     -    3s
     0     0    6.00000    0   45   13.00000    6.00000  53.8%     -    3s
     0     0    6.00000    0   43   13.00000    6.00000  53.8%     -    3s
     0     0    6.00000    0   51   13.00000    6.00000  53.8%     -    3s
     0     0    6.00000    0   18   13.00000    6.00000  53.8%     -    4s
     0     0    6.00000    0   56   13.00000    6.00000  53.8%     -    4s
     0     0    6.00000    0   33   13.00000    6.00000  53.8%     -    4s
     0     0    6.00000    0   51   13.00000    6.00000  53.8%     -    4s
     0     0    6.00000    0   39   13.00000    6.00000  53.8%     -    4s
     0     0    6.00000    0   52   13.00000    6.00000  53.8%     -    4s
     0     0    6.00000    0   55   13.00000    6.00000  53.8%     -    4s
     0     0    6.00000    0   47   13.00000    6.00000  53.8%     -    4s
     0     0    6.00000    0   55   13.00000    6.00000  53.8%     -    5s
     0     0    6.00000    0   52   13.00000    6.00000  53.8%     -    5s
     0     0    6.00288    0   32   13.00000    6.00288  53.8%     -    5s
     0     0    6.00813    0   58   13.00000    6.00813  53.8%     -    5s
     0     0    6.01448    0   29   13.00000    6.01448  53.7%     -    5s
     0     0    6.02043    0   51   13.00000    6.02043  53.7%     -    5s
     0     0    6.02346    0   46   13.00000    6.02346  53.7%     -    5s
     0     0    6.02777    0   40   13.00000    6.02777  53.6%     -    5s
     0     0    6.03028    0   39   13.00000    6.03028  53.6%     -    6s
     0     0    6.03403    0   44   13.00000    6.03403  53.6%     -    6s
     0     0    6.03673    0   37   13.00000    6.03673  53.6%     -    6s
     0     0    6.04132    0   55   13.00000    6.04132  53.5%     -    6s
     0     0    6.04472    0   42   13.00000    6.04472  53.5%     -    6s
     0     0    6.04758    0   52   13.00000    6.04758  53.5%     -    6s
     0     0    6.04928    0   48   13.00000    6.04928  53.5%     -    6s
     0     0    6.05341    0   34   13.00000    6.05341  53.4%     -    6s
     0     0    6.05656    0   31   13.00000    6.05656  53.4%     -    7s
     0     0    6.06365    0   35   13.00000    6.06365  53.4%     -    7s
     0     0    6.06626    0   31   13.00000    6.06626  53.3%     -    7s
     0     0    6.07146    0   33   13.00000    6.07146  53.3%     -    7s
     0     0    6.07882    0   44   13.00000    6.07882  53.2%     -    7s
     0     0    6.08638    0   52   13.00000    6.08638  53.2%     -    7s
     0     0    6.09060    0   39   13.00000    6.09060  53.1%     -    7s
     0     0    6.09174    0   61   13.00000    6.09174  53.1%     -    7s
     0     0    6.09498    0   27   13.00000    6.09498  53.1%     -    7s
     0     0    6.09808    0   35   13.00000    6.09808  53.1%     -    7s
     0     0    6.10046    0   44   13.00000    6.10046  53.1%     -    8s
     0     0    6.10252    0   43   13.00000    6.10252  53.1%     -    8s
     0     0    6.10496    0   26   13.00000    6.10496  53.0%     -    8s
     0     0    6.10676    0   50   13.00000    6.10676  53.0%     -    8s
     0     0    6.10815    0   16   13.00000    6.10815  53.0%     -    8s
     0     0    6.11201    0   43   13.00000    6.11201  53.0%     -    8s
     0     0    6.11312    0   43   13.00000    6.11312  53.0%     -    8s
     0     0    6.11440    0   55   13.00000    6.11440  53.0%     -    8s
     0     0    6.11738    0   29   13.00000    6.11738  52.9%     -    8s
     0     0    6.11853    0   53   13.00000    6.11853  52.9%     -    8s
     0     0    6.12030    0   49   13.00000    6.12030  52.9%     -    8s
     0     0    6.12079    0   54   13.00000    6.12079  52.9%     -    8s
     0     0    6.12268    0   36   13.00000    6.12268  52.9%     -    8s
     0     0    6.12566    0   34   13.00000    6.12566  52.9%     -    8s
     0     0    6.12745    0   11   13.00000    6.12745  52.9%     -    9s
     0     0    6.12878    0   50   13.00000    6.12878  52.9%     -    9s
     0     0    6.12985    0   35   13.00000    6.12985  52.8%     -    9s
     0     0    6.13446    0   56   13.00000    6.13446  52.8%     -    9s
     0     0    6.13698    0   55   13.00000    6.13698  52.8%     -    9s
     0     0    6.13845    0   59   13.00000    6.13845  52.8%     -    9s
     0     0    6.14156    0   53   13.00000    6.14156  52.8%     -    9s
     0     0    6.14401    0   64   13.00000    6.14401  52.7%     -    9s
     0     0    6.14506    0   34   13.00000    6.14506  52.7%     -    9s
     0     0    6.14855    0   57   13.00000    6.14855  52.7%     -    9s
     0     0    6.14974    0   21   13.00000    6.14974  52.7%     -    9s
     0     0    6.15125    0   44   13.00000    6.15125  52.7%     -    9s
     0     0    6.15462    0   25   13.00000    6.15462  52.7%     -    9s
     0     0    6.15844    0   55   13.00000    6.15844  52.6%     -    9s
     0     0    6.16350    0   50   13.00000    6.16350  52.6%     -   10s
     0     0    6.16497    0   55   13.00000    6.16497  52.6%     -   10s
     0     0    6.16639    0   38   13.00000    6.16639  52.6%     -   10s
     0     0    6.16811    0   46   13.00000    6.16811  52.6%     -   10s
     0     0    6.17350    0   40   13.00000    6.17350  52.5%     -   10s
     0     0    6.17505    0   65   13.00000    6.17505  52.5%     -   10s
     0     0    6.17882    0   45   13.00000    6.17882  52.5%     -   10s
     0     0    6.18197    0   54   13.00000    6.18197  52.4%     -   10s
     0     0    6.18319    0   34   13.00000    6.18319  52.4%     -   10s
     0     0    6.18751    0   62   13.00000    6.18751  52.4%     -   10s
     0     0    6.18751    0   49   13.00000    6.18751  52.4%     -   10s
H    0     0                      12.0000000    6.18751  48.4%     -   10s

Resetting heuristic parameters to focus on improving solution
(using Heuristics=0.5 and RINS=10)...

     0     0    6.18751    0   44   12.00000    6.18751  48.4%     -   10s
     0     2    6.18751    0   41   12.00000    6.18751  48.4%     -   10s
     1     4    6.18751    1   41   12.00000    6.18751  48.4%  32.0   10s
   505   409    6.57666   10   41   12.00000    6.18751  48.4%  67.4   15s
  1579   949    7.29130   29   49   12.00000    6.18751  48.4%   110   20s
  3945  2933    8.49861   24   44   12.00000    7.00000  41.7%   103   25s
  6027  4814    8.00000   24   50   12.00000    7.04864  41.3%   104   30s
  7894  6052 infeasible   27        12.00000    7.22859  39.8%   106   35s
  9624  7625    9.00000   35   18   12.00000    8.00000  33.3%   107   41s
 11235  8742 infeasible   30        12.00000    8.00000  33.3%   103   45s
 12927  9889    9.00000   39   15   12.00000    8.00000  33.3%   101   50s
 15018 11317    8.01773   28   32   12.00000    8.00000  33.3%   101   56s
 16123 12237    8.28076   23   71   12.00000    8.00000  33.3%   101   60s
 17797 13468    8.05727   30   43   12.00000    8.00000  33.3%   101   66s
 18987 14244    9.00000   27   27   12.00000    8.00000  33.3%   102   70s
 20639 15635    8.38010   33   47   12.00000    8.00000  33.3%   103   76s
 22106 16584    9.00000   26   21   12.00000    8.00000  33.3%   104   80s
 23284 17551    8.01754   35   38   12.00000    8.00000  33.3%   105   85s
 24726 18664    9.00000   23   39   12.00000    8.00000  33.3%   107   91s
 26368 19789    9.25563   30   33   12.00000    8.00000  33.3%   108   97s
 27215 20221 infeasible   32        12.00000    8.00000  33.3%   108  100s
 28959 21472    9.00000   27   46   12.00000    8.02066  33.2%   107  107s
 30011 22003    8.81873   29   42   12.00000    8.03735  33.0%   107  110s
 31842 22912 infeasible   24        12.00000    8.07122  32.7%   108  117s
 32721 23271    9.01743   31   17   12.00000    8.09713  32.5%   108  121s
 33433 23732    9.00000   26   25   12.00000    8.11456  32.4%   109  125s
 35256 24476    9.00000   26   74   12.00000    8.20043  31.7%   111  132s
 35989 25196 infeasible   28        12.00000    8.26339  31.1%   113  137s
 37026 25803   10.89367   31   50   12.00000    8.31063  30.7%   114  142s
 37961 26484    9.10723   29   55   12.00000    8.37936  30.2%   114  147s
 39108 27367 infeasible   26        12.00000    8.49936  29.2%   115  152s
 40734 28296   10.00000   33   20   12.00000    8.83236  26.4%   114  158s
 42445 29047    9.87096   40   51   12.00000    9.00000  25.0%   114  166s
 43716 30075   10.00000   37   18   12.00000    9.00000  25.0%   114  172s
 45446 31043    9.06112   31   33   12.00000    9.00000  25.0%   113  177s
 46974 32276    9.08114   33   41   12.00000    9.00000  25.0%   112  183s
 48990 33343   10.00000   39   23   12.00000    9.00000  25.0%   111  188s
 50749 33993    9.00000   25   18   12.00000    9.00000  25.0%   111  195s
 51851 34991   10.06882   51   30   12.00000    9.00000  25.0%   110  200s
 53593 35898   10.00000   31   29   12.00000    9.00000  25.0%   110  206s
 55150 36736   10.03269   44   13   12.00000    9.00000  25.0%   110  212s
 56517 37509   10.00000   33   26   12.00000    9.00000  25.0%   109  219s
 57931 38619    9.21540   41   25   12.00000    9.00000  25.0%   109  224s
 59805 39415   10.00000   33   26   12.00000    9.00000  25.0%   109  230s
 61259 40364    9.14380   44   30   12.00000    9.00000  25.0%   108  236s
 62904 41133   10.00000   36   19   12.00000    9.00000  25.0%   108  241s
 64173 41988    9.07757   42   31   12.00000    9.00000  25.0%   108  247s
 65641 42635    9.02713   40   33   12.00000    9.00000  25.0%   108  254s
 66750 43463   10.00000   40   28   12.00000    9.00000  25.0%   108  260s
 68187 44398 infeasible   34        12.00000    9.00000  25.0%   108  266s
 69797 45440    9.00000   36   16   12.00000    9.00000  25.0%   108  272s
 71577 46157   10.00000   36   15   12.00000    9.00000  25.0%   107  278s
 72783 47218    9.41086   37   31   12.00000    9.00000  25.0%   107  284s
 74440 48016    9.00000   38   16   12.00000    9.00000  25.0%   107  291s
 75863 48809 infeasible   37        12.00000    9.00000  25.0%   107  297s
 77180 49736    9.05889   38   32   12.00000    9.00000  25.0%   107  303s
 78767 50510    9.06943   32   39   12.00000    9.00000  25.0%   107  309s
 80039 51382    9.04524   37   34   12.00000    9.00000  25.0%   107  316s
 81461 52190 infeasible   33        12.00000    9.00000  25.0%   107  322s
 82944 53014   10.00000   36   29   12.00000    9.00000  25.0%   107  328s
 84380 53604 infeasible   34        12.00000    9.00000  25.0%   107  334s
 85432 54647   10.05400   38   53   12.00000    9.00000  25.0%   107  340s
 87131 55498    9.00000   30   26   12.00000    9.00000  25.0%   107  346s
 88617 56258     cutoff   39        12.00000    9.00000  25.0%   107  354s
 89955 56844   10.45959   38   26   12.00000    9.00000  25.0%   107  362s
 91010 57777 infeasible   41        12.00000    9.00000  25.0%   107  368s
 92507 58718   10.00000   30   35   12.00000    9.00000  25.0%   107  374s
 94038 59486 infeasible   34        12.00000    9.00000  25.0%   107  381s
 95372 60288    9.27664   34   48   12.00000    9.00000  25.0%   107  387s
 96647 61173    9.27205   35   47   12.00000    9.00000  25.0%   107  393s
 98076 61825    9.22039   31   52   12.00000    9.00000  25.0%   107  401s
 99107 62753    9.05916   41   28   12.00000    9.00000  25.0%   107  407s
 100629 63927    9.15435   34   37   12.00000    9.00000  25.0%   107  413s
 102377 64815    9.05789   40   37   12.00000    9.00000  25.0%   107  419s
 103827 65652   10.00000   34   25   12.00000    9.00000  25.0%   107  425s
 105159 66316    9.03190   27   53   12.00000    9.00000  25.0%   107  432s
 106163 67046 infeasible   40        12.00000    9.00000  25.0%   107  438s
 107424 67844    9.19772   28   41   12.00000    9.00000  25.0%   107  445s
 108721 68502    9.00000   34   47   12.00000    9.00000  25.0%   108  451s
 109904 69069    9.03822   29   50   12.00000    9.00000  25.0%   108  458s
 110954 69855    9.22141   29   40   12.00000    9.00000  25.0%   108  464s
 112379 70581    9.00000   30   20   12.00000    9.00000  25.0%   108  470s
 113692 71150    9.13351   34   43   12.00000    9.00000  25.0%   109  478s
 114643 71941    9.13882   38   24   12.00000    9.00000  25.0%   109  484s
 116014 72705    9.00616   37   44   12.00000    9.00000  25.0%   109  490s
 117295 73542 infeasible   29        12.00000    9.00000  25.0%   109  497s
 118725 74385    9.00324   36   50   12.00000    9.00000  25.0%   109  503s
 120103 75185   10.00000   37   19   12.00000    9.00000  25.0%   110  511s
 121400 75778   10.01323   39   28   12.00000    9.00000  25.0%   110  518s
 122438 76577    9.00611   28   34   12.00000    9.00000  25.0%   110  525s
 123789 77428   10.00000   29   32   12.00000    9.00000  25.0%   110  531s
 125202 78256    9.07789   34   22   12.00000    9.00000  25.0%   110  537s
 126605 78897   10.02814   32   40   12.00000    9.00000  25.0%   110  544s
 127787 79394    9.04338   33   18   12.00000    9.00000  25.0%   111  551s
 128720 80112 infeasible   30        12.00000    9.00000  25.0%   111  557s
 130021 80670   10.07513   31   59   12.00000    9.00000  25.0%   111  563s
 131146 81597    9.23137   35   39   12.00000    9.00000  25.0%   112  569s
 132646 82363     cutoff   29        12.00000    9.00000  25.0%   112  576s
 134039 82949    9.00302   33   34   12.00000    9.00000  25.0%   112  584s
 134988 83742 infeasible   34        12.00000    9.00000  25.0%   112  590s
 136190 84609   10.00000   32   27   12.00000    9.00000  25.0%   112  597s
 137616 85315   10.01194   27   52   12.00000    9.00000  25.0%   112  604s
 138802 85883 infeasible   26        12.00000    9.00000  25.0%   113  611s
 139756 86779    9.00000   31   64   12.00000    9.00000  25.0%   113  617s
 141236 87555    9.05253   28   47   12.00000    9.00000  25.0%   113  624s
 142545 88398   10.00000   40   19   12.00000    9.00000  25.0%   113  631s
 143987 89204   10.00000   24   50   12.00000    9.00000  25.0%   113  638s
 145324 89968    9.00000   30   21   12.00000    9.00000  25.0%   114  645s
 146605 90509   10.00000   35   26   12.00000    9.00000  25.0%   114  653s
 147580 91283    9.40935   29   58   12.00000    9.00000  25.0%   114  660s
 148895 92167    9.06549   37   43   12.00000    9.00000  25.0%   114  665s
 150382 93078   10.00000   27   52   12.00000    9.00000  25.0%   114  672s
 151814 93646    9.17356   28   58   12.00000    9.00000  25.0%   115  680s
 152741 94467    9.02424   27   42   12.00000    9.00000  25.0%   115  687s
 154043 95279 infeasible   35        12.00000    9.00000  25.0%   115  694s
 155409 96005   10.00000   28   53   12.00000    9.00000  25.0%   115  700s
 156587 96946   10.00000   30   39   12.00000    9.00000  25.0%   115  706s
 158123 97578    9.00000   28   37   12.00000    9.00000  25.0%   116  714s
 159116 98477    9.05550   28   65   12.00000    9.00000  25.0%   116  721s
 160532 99202   10.00000   26   67   12.00000    9.00000  25.0%   116  727s
 161779 99982   10.00000   26   29   12.00000    9.00000  25.0%   116  734s
 163105 100585    9.10742   29   67   12.00000    9.00000  25.0%   116  742s
 164080 101556   10.00000   35   33   12.00000    9.00000  25.0%   117  748s
 165613 102428    9.00000   31   34   12.00000    9.00000  25.0%   117  755s
 166943 103304    9.12257   25   52   12.00000    9.00000  25.0%   117  762s
 168439 104051   10.09554   22   71   12.00000    9.00000  25.0%   117  769s
 169665 104695    9.02614   27   55   12.00000    9.00000  25.0%   117  777s
 170645 105669 infeasible   33        12.00000    9.00000  25.0%   117  784s
 172051 106630   10.00000   29   51   12.00000    9.00000  25.0%   118  790s
 173461 107532    9.23041   25   43   12.00000    9.00000  25.0%   118  796s
 174928 108430   10.00000   30   29   12.00000    9.00000  25.0%   118  803s
 176332 109134 infeasible   35        12.00000    9.00000  25.0%   118  811s
 177388 109875    9.03075   37   19   12.00000    9.00000  25.0%   118  818s
 178597 110657    9.22107   29   63   12.00000    9.00000  25.0%   118  824s
 180111 111411    9.06154   35   41   12.00000    9.00163  25.0%   118  831s
 181804 112137   10.00000   31   39   12.00000    9.00912  24.9%   118  839s
 183425 112748   10.00000   39   18   12.00000    9.01665  24.9%   118  846s
 184954 113347   10.00000   39   30   12.00000    9.02284  24.8%   118  853s
 186435 113798 infeasible   37        12.00000    9.03133  24.7%   118  861s
 187545 114479   10.00000   36   27   12.00000    9.03671  24.7%   118  867s
 189218 115108   10.00000   34   15   12.00000    9.04552  24.6%   118  874s
 190807 115627   11.00000   39   25   12.00000    9.05538  24.5%   118  880s
 192212 116090    9.09617   28   55   12.00000    9.06538  24.5%   118  887s
 193592 116541    9.61148   30   49   12.00000    9.07508  24.4%   118  894s
 194807 116913    9.17097   32   45   12.00000    9.08635  24.3%   118  902s
 195765 117351 infeasible   38        12.00000    9.09408  24.2%   118  908s
 197194 117797   10.00000   33   34   12.00000    9.11401  24.0%   118  914s
 198487 118195   10.32530   28   35   12.00000    9.13126  23.9%   119  922s
 199655 118501 infeasible   44        12.00000    9.15031  23.7%   119  929s
 200787 118832 infeasible   48        12.00000    9.17053  23.6%   119  936s
 201750 119082    9.73784   33   36   12.00000    9.19345  23.4%   119  942s
 202725 119482   10.46557   37   50   12.00000    9.22550  23.1%   120  948s
 203891 119842   10.00000   45   32   12.00000    9.26675  22.8%   120  955s
 205062 120171   10.00000   46   18   12.00000    9.32403  22.3%   120  962s
 206075 120420   10.11369   32   43   12.00000    9.40289  21.6%   120  969s
 206956 121101   10.12753   32   43   12.00000    9.55275  20.4%   121  977s
 208482 121733 infeasible   35        12.00000    9.61968  19.8%   121  984s
 210250 122310   10.10836   35   37   12.00000    9.64630  19.6%   121  991s
 212063 122664 infeasible   36        12.00000    9.68190  19.3%   121  999s
 213486 123248 infeasible   37        12.00000    9.70753  19.1%   121 1006s
 215468 123508   10.47526   33   45   12.00000    9.76444  18.6%   121 1013s
 217183 123708 infeasible   38        12.00000    9.82592  18.1%   120 1020s
 218919 123975   10.58389   43   43   12.00000    9.89523  17.5%   120 1028s
 220436 124588   10.01576   33   36   12.00000   10.00000  16.7%   120 1035s
 222186 124982   10.00000   27   36   12.00000   10.00000  16.7%   120 1043s
 223717 125453     cutoff   51        12.00000   10.00000  16.7%   120 1049s
 225668 125754   11.00000   38   24   12.00000   10.00000  16.7%   120 1057s
 227318 126117   11.11690   44   25   12.00000   10.00000  16.7%   120 1065s
 229324 126580   10.16274   41   26   12.00000   10.00000  16.7%   120 1072s
 231418 126907 infeasible   45        12.00000   10.00000  16.7%   120 1080s

Cutting planes:
  Learned: 296
  Gomory: 73
  Lift-and-project: 583
  Cover: 160
  Implied bound: 14
  MIR: 997
  Mixing: 54
  StrongCG: 206
  Flow cover: 2175
  Inf proof: 124
  Zero half: 1048
  RLT: 361
  Relax-and-lift: 486

Explored 232834 nodes (27931505 simplex iterations) in 1080.04 seconds (766.35 work units)
Thread count was 16 (of 16 available processors)

Solution count 7: 12 12 13 ... 56

Time limit reached
Best objective 1.200000000000e+01, best bound 1.000000000000e+01, gap 16.6667%

User-callback calls 556946, time in user-callback 2.16 sec
Set parameter TimeLimit to value 360
Gurobi Optimizer version 12.0.3 build v12.0.3rc0 (linux64 - "Ubuntu 22.04.5 LTS")

CPU model: Intel(R) Xeon(R) W-2145 CPU @ 3.70GHz, instruction set [SSE2|AVX|AVX2|AVX512]
Thread count: 8 physical cores, 16 logical processors, using up to 16 threads

Non-default parameters:
TimeLimit  360
Heuristics  0.1
MIPFocus  3
Presolve  2
ImproveStartGap  0.5

Optimize a model with 4594 rows, 3145 columns and 18991 nonzeros
Model fingerprint: 0x09a603fc
Model has 12 quadratic constraints
Variable types: 12 continuous, 3133 integer (3024 binary)
Coefficient statistics:
  Matrix range     [5e-01, 7e+03]
  QMatrix range    [1e+00, 1e+00]
  QLMatrix range   [1e+00, 1e+00]
  Objective range  [1e+00, 1e+00]
  Bounds range     [1e+00, 1e+00]
  RHS range        [1e+00, 2e+05]

MIP start from previous solve produced solution with objective 1418 (0.00s)
Loaded MIP start from previous solve with objective 1418

Presolve removed 3325 rows and 2581 columns
Presolve time: 0.05s
Presolved: 1269 rows, 564 columns, 6148 nonzeros
Presolved model has 11 quadratic constraint(s)
Variable types: 11 continuous, 553 integer (513 binary)

Resetting heuristic parameters to focus on improving solution
(using Heuristics=0.5 and RINS=10)...

Root relaxation presolve removed 865 rows and 374 columns
Root relaxation presolved: 404 rows, 190 columns, 1775 nonzeros


Root relaxation: objective 1.226000e+03, 30 iterations, 0.00 seconds (0.00 work units)

    Nodes    |    Current Node    |     Objective Bounds      |     Work
 Expl Unexpl |  Obj  Depth IntInf | Incumbent    BestBd   Gap | It/Node Time

     0     0 1226.00000    0   18 1418.00000 1226.00000  13.5%     -    0s
     0     0 1226.00000    0   17 1418.00000 1226.00000  13.5%     -    0s
     0     2 1227.00000    0   17 1418.00000 1227.00000  13.5%     -    0s
   680   348 1360.00000   13   33 1418.00000 1271.00000  10.4%  33.6    5s
  1067   432 infeasible   22      1418.00000 1329.00000  6.28%  88.2   10s

Cutting planes:
  Learned: 29
  Gomory: 19
  Lift-and-project: 32
  Cover: 59
  Implied bound: 2
  Projected implied bound: 1
  MIR: 20
  Mixing: 15
  StrongCG: 7
  Flow cover: 175
  GUB cover: 4
  Inf proof: 1
  Zero half: 30
  RLT: 7
  Relax-and-lift: 36

Explored 8235 nodes (276555 simplex iterations) in 13.44 seconds (11.31 work units)
Thread count was 16 (of 16 available processors)

Solution count 1: 1418 

Optimal solution found (tolerance 1.00e-04)
Best objective 1.418000000000e+03, best bound 1.418000000000e+03, gap 0.0000%

User-callback calls 23959, time in user-callback 0.05 sec
